,image_id,file_id,img_file_orig,justification,occurances,transcribed_text,handwriting,transcribed_orig_if_handwritting,notes,
4921,IMG_4938,PREM_15_475,IMG_4938_PREM_15_475,J_Legal_Procedure,1,"Authority for arrest is contained in a document discovered in the Affidavid of Mr. Shillington. So far as material, it provides as follows:- 1. By virture of the authorisation given to me by an Officer of the Royal Ulster Constabulary, units of the Brigade are to effect the arrest without warrant of those named in Appendix 1 to this Order and their detention for a period of not more than 48 hours for the purpose of interrogation at a suitable Police Office.",,,,
4977,IMG_5089,PREM_15_475,IMG_5089_PREM_15_475,J_Legal_Procedure,1,You will know that I set up a Committee of Inquiry under the Chairmanship of Sir Edmund Compton to investigate allegations against the security forces of physical brutality in Northern Ireland arising out of events on 9th August when a large number of arrests were made consequential on the decision of the Government of Northern Ireland to give effect to their powers of detention and internment. ,,,,
8533,IMG_0143,PREM_15_478,PREM_15_478_143,J_Terrorism,1,Internment had been introduced because the Government was faced with terrorism on an intolerable scale. It was the common interest of both countries to combat the activities of gunmen and it was hoped that the Governmnet of the Republic would be able to help achieve that objective.,,,,
6601,IMG_0160,PREM_15_478,PREM_15_478_160,J_Misc,1,"As you will see the best news is the good ""catch"" (304 [] 464).",,,,
1022,IMG_0186,PREM_15_478,PREM_15_478_186,J_Development-Unity,1,"serious acts of terrorism by the I.R.A. and their recent declarations of their intention to continue and even escalate their campaign have made it essential to take this action, however abhorrent, [] in order to prevent the undermining of economic and social stability in Northern Ireland.",y,serious acts of terrorism by the I.R.A. and their recent declarations of their intention to continue and even escalate their campaign have made it impossible for him to resist the pressures on him for more drastic action to arrest the deterioration of morale and the undermining of economic and social stability in Northern Ireland.,,
3297,IMG_0186,PREM_15_478,PREM_15_478_186,J_Last-resort,1,"In purely military terms, seeking to contain this deteriorating situation by the means employed hitherto would have meant at best a long haul; and Faulkner's judgment was that the consequences of that for thecommunity would be worse than the consequences of what is now proposed.",y,"In purely military terms, seeking to contain the situation by the means employed hitherto would have meant at best a long haul; and Faulkner's judgment was that the consequences of that for thecommunity would be worse than the consequences of what is now proposed.",,
8659,IMG_0186,PREM_15_478,PREM_15_478_186,J_Terrorism,1,"serious acts of terrorism by the I.R.A. and their recent declarations of their intention to continue and even escalate their campaign have made it essential to take this action, however abhorrent, [] in order to prevent the undermining of economic and social stability in Northern Ireland.",y,serious acts of terrorism by the I.R.A. and their recent declarations of their intention to continue and even escalate their campaign have made it impossible for him to resist the pressures on him for more drastic action to arrest the deterioration of morale and the undermining of economic and social stability in Northern Ireland.,,
9247,IMG_0186,PREM_15_478,PREM_15_478_186,J_Utilitarian-Deterrence,1,"serious acts of terrorism by the I.R.A. and their recent declarations of their intention to continue and even escalate their campaign have made it essential to take this action, however abhorrent, [] in order to prevent the undermining of economic and social stability in Northern Ireland.",y,serious acts of terrorism by the I.R.A. and their recent declarations of their intention to continue and even escalate their campaign have made it impossible for him to resist the pressures on him for more drastic action to arrest the deterioration of morale and the undermining of economic and social stability in Northern Ireland.,,
553,IMG_0187,PREM_15_478,PREM_15_478_187,J_Denial,1,"An advisory committee will be set up, to which any one who is interned will have the right to make representations.",,"An advisory committee will be set up, to which any one who is interned will have the right to make representations.",,
3773,IMG_0189,PREM_15_478,PREM_15_478_189,J_Law-and-order,1,The security forces are [currently] arresting and detaining people suspected of responsibility for committing or abetting acts of terrorism and other breaches of the peace designed to lead to a breakdown of law and order in Northern Ireland.,y,so as to enable the security forces to arrest and detain people suspected of responsibility for committing or abetting acts of terrorism and other breaches of the peace designed to lead to a breakdown of law and order in Northern Ireland.,,
7546,IMG_0189,PREM_15_478,PREM_15_478_189,J_Political-Strategic,1,He will at the same time announce that all marches and parades are banned until further notice.,y,They will at the same time announce that all marches and parades are banned until further notice.,,
8666,IMG_0189,PREM_15_478,PREM_15_478_189,J_Terrorism,1,The security forces are [currently] arresting and detaining people suspected of responsibility for committing or abetting acts of terrorism and other breaches of the peace designed to lead to a breakdown of law and order in Northern Ireland.,y,so as to enable the security forces to arrest and detain people suspected of responsibility for committing or abetting acts of terrorism and other breaches of the peace designed to lead to a breakdown of law and order in Northern Ireland.,,
1050,IMG_0190,PREM_15_478,PREM_15_478_190,J_Development-Unity,1,declarations of their intention to continue and even escalate that campaign have made it impossible for him to [] the pressures on him for more drastic action to arrest the deterioration of morale and the undermining of economic and social stability in Northern Ireland. ,,,,
3304,IMG_0190,PREM_15_478,PREM_15_478_190,J_Last-resort,1,"In purely military terms, seeking to contain the situation by the means employed hitherto would have meant at best a long haul.",,,,
7553,IMG_0190,PREM_15_478,PREM_15_478_190,J_Political-Strategic,1,to [] the pressures on him for more drastic action to arrest the deterioration of morale and the undermining of economic and social stability in Northern Ireland.,,,,
8673,IMG_0190,PREM_15_478,PREM_15_478_190,J_Terrorism,1,declarations of their intention to continue and even escalate that campaign have made it impossible for him to [] the pressures on him for more drastic action to arrest the deterioration of morale and the undermining of economic and social stability in Northern Ireland. ,,,,
9254,IMG_0190,PREM_15_478,PREM_15_478_190,J_Utilitarian-Deterrence,1,Faulkner's judgment was that the consequences of that for the community would be worse than the consequences of what is now proposed.,,,,
6699,IMG_0191,PREM_15_478,PREM_15_478_191,J_Misc,1,also the [fact] that the intimidation of the population by the terrorists has been increasingly hampering the process of gathering intelligence.,,,,
8680,IMG_0191,PREM_15_478,PREM_15_478_191,J_Terrorism,1,also the [fact] that the intimidation of the population by the terrorists has been increasingly hampering the process of gathering intelligence.,,,,
6706,IMG_0192,PREM_15_478,PREM_15_478_192,J_Misc,1,"If thi smove enables us to reduce the number of troops commited to Northern Ireland earlier than we would otherwise have done, that will be a welcome consequence of it.",,,,
560,IMG_0193,PREM_15_478,PREM_15_478_193,J_Denial,1,An advisory committee will be set up to which any one who is interned will have the right to make representations.,y ,,,
1057,IMG_0193,PREM_15_478,PREM_15_478_193,J_Development-Unity,1,"I have however sent a message to Lynch, asking him to react with understanding, even if with regret, to maintain the pressures he has [] been exerting on the IRA south of the border, and emphasising that we hope that these measures can be strictly temporary, and will not [prejudicate] continuing progress in the task of making progress with building more harmonious inter-community relations in Northern Ireland.",y ,"I have sent a further message to Mr. Lynch, asking him to react with understanding, even if with regret, and emphasising that we hope that these measures can be strictly temporary, and will serve to re-establish a situation in which we can get back to the task of making progress with building more harmonious inter-community relations in Northern Ireland.",,
3101,IMG_0193,PREM_15_478,PREM_15_478_193,J_Intl-Domestic_Precedent,1,The effectiveness of internment north of the border would be greater if the Irish Government south of the border were prepared to introduce internment at the same time; but all that we know of the Lynch Government [] suggest that there is no possibility of parallel action south of the border.,y ,"A little time ago, I was in touch with Mr. Lynch to try to discover whether he was contemplating the possibility of internment south of the border, if we were forced to it north of the border. Clearly that would have added to its effectiveness; but our discussions showed that there was no possibility of parallel action south of the border.",,
6713,IMG_0193,PREM_15_478,PREM_15_478_193,J_Misc,1,"I have however sent a message to Lynch, asking him to react with understanding, even if with regret, to maintain the pressures he has [] been exerting on the IRA south of the border, and emphasising that we hope that these measures can be strictly temporary, and will not [prejudicate] continuing progress in the task of making progress with building more harmonious inter-community relations in Northern Ireland.",y ,"I have sent a further message to Mr. Lynch, asking him to react with understanding, even if with regret, and emphasising that we hope that these measures can be strictly temporary, and will serve to re-establish a situation in which we can get back to the task of making progress with building more harmonious inter-community relations in Northern Ireland.",,
567,IMG_0195,PREM_15_478,PREM_15_478_195,J_Denial,1,"An advisory committee will be set up, to which anyone who is intered will have the right to make representations.",,,,
3780,IMG_0195,PREM_15_478,PREM_15_478_195,J_Law-and-order,1,"A reminder from you that violence serves no purpose, and that internment is aimed against particular individuals who are avowedly working for a breakdown of law and order, would be invaluable.",,,,
6720,IMG_0195,PREM_15_478,PREM_15_478_195,J_Misc,1,"5. When Faulkner came to London last week, he told us that he had come to the conclusion that internment was now the right and indeed inevitable course.",,,,
7595,IMG_0198,PREM_15_478,PREM_15_478_198,J_Political-Strategic,1,"He will also announce that all outstanding applications to start rifle clubs are being refused, and that no new applications will be considered.",,,,
1085,IMG_0199,PREM_15_478,PREM_15_478_199,J_Development-Unity,1,escalate their campaign have made it impossible for him to resist the pressures on him for more drastic action to [] the deterioration of morale and the undermining of economic and social stability in Norther Ireland.,y,,,
3325,IMG_0199,PREM_15_478,PREM_15_478_199,J_Last-resort,1,"In purely military terms, seeking to contain the deteriorating situation by the means employed hitherto would have [meant a] best in long haul;",,,,
8708,IMG_0199,PREM_15_478,PREM_15_478_199,J_Terrorism,1,escalate their campaign have made it impossible for him to resist the pressures on him for more drastic action to [] the deterioration of morale and the undermining of economic and social stability in Norther Ireland.,y,,,
1092,IMG_0200,PREM_15_478,PREM_15_478_200,J_Development-Unity,1,"escalate their campaign have made it essential to take this action however abhorent in order to prevent ... to resist the pressures on him, not only from his political supporters but also from the in-district community and others whose lives are being disrupted, for more drastic action.",y,"escalate their campaign have made it impossible for him to resist the pressures on him, not only from his political supporters but from the business community and others whose lives are being disrupted, for more drastic action.",,
3332,IMG_0200,PREM_15_478,PREM_15_478_200,J_Last-resort,1,"In purely military terms [taking to] action the situation by the means employed hitherto would have meant at best a long haul, and Faulkner's judgment was that the consequences of that for the community would be worse than the consequences of what is now proposed.",y,"In purely military terms it would perhaps have been possible to hope that the situation could be restored by the means employed hitherto, as I know you yourself would have preferred. But that would have at best been a long haul, and Faulkner's judgment was that the consequences of that for the community would be worse than the consequences of what is now proposed.",,
7609,IMG_0200,PREM_15_478,PREM_15_478_200,J_Political-Strategic,1,"escalate their campaign have made it essential to take this action however abhorent in order to prevent ... to resist the pressures on him, not only from his political supporters but also from the in-district community and others whose lives are being disrupted, for more drastic action.",y,"escalate their campaign have made it impossible for him to resist the pressures on him, not only from his political supporters but from the business community and others whose lives are being disrupted, for more drastic action.",,
8715,IMG_0200,PREM_15_478,PREM_15_478_200,J_Terrorism,1,"escalate their campaign have made it essential to take this action however abhorent in order to prevent ... to resist the pressures on him, not only from his political supporters but also from the in-district community and others whose lives are being disrupted, for more drastic action.",y,"escalate their campaign have made it impossible for him to resist the pressures on him, not only from his political supporters but from the business community and others whose lives are being disrupted, for more drastic action.",,
9282,IMG_0200,PREM_15_478,PREM_15_478_200,J_Utilitarian-Deterrence,1,"In purely military terms [taking to] action the situation by the means employed hitherto would have meant at best a long haul, and Faulkner's judgment was that the consequences of that for the community would be worse than the consequences of what is now proposed.",y,"In purely military terms it would perhaps have been possible to hope that the situation could be restored by the means employed hitherto, as I know you yourself would have preferred. But that would have at best been a long haul, and Faulkner's judgment was that the consequences of that for the community would be worse than the consequences of what is now proposed.",,
581,IMG_0201,PREM_15_478,PREM_15_478_201,J_Denial,1,"We have however [] made clear our view that the measures taken should not discriminate as between the different sections of the community, except as the facts of the situation make inevitable. ",y,"We have however sought to ensure that the measures taken do not discriminate as between the different sections of the community, except as the facts of the situation make inevitable. Protestant as well as Catholic and I.R.A. extremists will be liable to internment.",,
8722,IMG_0201,PREM_15_478,PREM_15_478_201,J_Terrorism,1,"We have however [] made clear our view that the measures taken should not discriminate as between the different sections of the community, except as the facts of the situation make inevitable. ",y,"We have however sought to ensure that the measures taken do not discriminate as between the different sections of the community, except as the facts of the situation make inevitable. Protestant as well as Catholic and I.R.A. extremists will be liable to internment.",,
588,IMG_0202,PREM_15_478,PREM_15_478_202,J_Denial,1,"An advisory committee will be set up, to which any one who is interned will have the right to make representations.",,,,
3794,IMG_0202,PREM_15_478,PREM_15_478_202,J_Law-and-order,1,"There will be many who will call for violent action in response to these measures; a reminder from you that violence serves no purpose, and that internment is [] against particular individuals who are avowedly working for a breakdown of law and order, would be invaluable.",,,,
1099,IMG_0203,PREM_15_478,PREM_15_478_203,J_Development-Unity,1,"Our hope is that these measures can be strictly temporary, will serve to re-establish a situation in which the many social and other reforms that have been introduced and are [] become are recognised at their true value, and will not prejudice continuing progress on the task of building more harmonious inter-community relations in Northern Ireland.",y,"Our hope certainly is that they can be strictly temporary, and will serve to re-establish a situation in which the many social and other reforms that have been introduced are recognised at their true value, and progress can again be [] on the task of building more harmonious inter-community relations in Northern Ireland.",,
6762,IMG_0203,PREM_15_478,PREM_15_478_203,J_Misc,1,"Our hope is that these measures can be strictly temporary, will serve to re-establish a situation in which the many social and other reforms that have been introduced and are [] become are recognised at their true value, and will not prejudice continuing progress on the task of building more harmonious inter-community relations in Northern Ireland.",y,"Our hope certainly is that they can be strictly temporary, and will serve to re-establish a situation in which the many social and other reforms that have been introduced are recognised at their true value, and progress can again be [] on the task of building more harmonious inter-community relations in Northern Ireland.",,
1106,IMG_0205,PREM_15_478,PREM_15_478_205,J_Development-Unity,1,"The latest series of acts of terrorism by the I.R.A. and their recent declarations of their intention to continue and even escalate that campaign have made it essential to take this action, however abhorrent, in order to prevent the undermining of economic and social stability in Northern Ireland.",y,The latest series of acts of terrorism by the I.R.A. and their recent declarations of their intention to continue and even escalate that campaign have made it impossible for him to resist the pressures on him for more drastic action to arrest the deterioration of morale and the undermining of economic and social stability in Northern Ireland.,,
3339,IMG_0205,PREM_15_478,PREM_15_478_205,J_Last-resort,1,"In purely military terms, seeking to contain this deteriorating situation by the means employed hitherto would have meant at best a long haul.",y,"In purely military terms, seeking to contain the situation by the means employed hitherto would have meant at best a long haul.",,
3808,IMG_0205,PREM_15_478,PREM_15_478_205,J_Law-and-order,1,"There is also the fact that the intimidation of the population by the terrorists has been increasingly hampering the process of gathering intelligence, and has impeded the cause of justice.",y,There is also the fact that the intimidation of the population by the terrorists has been increasingly hampering the process of gathering intelligence.,,
6776,IMG_0205,PREM_15_478,PREM_15_478_205,J_Misc,1,"There is also the fact that the intimidation of the population by the terrorists has been increasingly hampering the process of gathering intelligence, and has impeded the cause of justice.",y,There is also the fact that the intimidation of the population by the terrorists has been increasingly hampering the process of gathering intelligence.,,
7623,IMG_0205,PREM_15_478,PREM_15_478_205,J_Political-Strategic,1,"The latest series of acts of terrorism by the I.R.A. and their recent declarations of their intention to continue and even escalate that campaign have made it essential to take this action, however abhorrent, in order to prevent the undermining of economic and social stability in Northern Ireland.",y,The latest series of acts of terrorism by the I.R.A. and their recent declarations of their intention to continue and even escalate that campaign have made it impossible for him to resist the pressures on him for more drastic action to arrest the deterioration of morale and the undermining of economic and social stability in Northern Ireland.,,
8736,IMG_0205,PREM_15_478,PREM_15_478_205,J_Terrorism,1,"The latest series of acts of terrorism by the I.R.A. and their recent declarations of their intention to continue and even escalate that campaign have made it essential to take this action, however abhorrent, in order to prevent the undermining of economic and social stability in Northern Ireland.",y,The latest series of acts of terrorism by the I.R.A. and their recent declarations of their intention to continue and even escalate that campaign have made it impossible for him to resist the pressures on him for more drastic action to arrest the deterioration of morale and the undermining of economic and social stability in Northern Ireland.,,
8737,IMG_0205,PREM_15_478,PREM_15_478_205,J_Terrorism,2,"There is also the fact that the intimidation of the population by the terrorists has been increasingly hampering the process of gathering intelligence, and has impeded the cause of justice.",y,There is also the fact that the intimidation of the population by the terrorists has been increasingly hampering the process of gathering intelligence.,,
6783,IMG_0206,PREM_15_478,PREM_15_478_206,J_Misc,1,"I have however sent a message to Lynch, asking him to react with understanding, even if with regret, and emphasising that we hope that these measures can be strictly temporary",y,"I have however sent a message to Lynch, asking him to react with understanding, even if with regret, to maintain the pressures he has discretely been exerting on the I.R.A. south of the border, and emphasising that we hope that these measures can be strictly temporary",,
3346,IMG_0215,PREM_15_478,PREM_15_478_215,J_Last-resort,1,"On internment, the argument that seems",,,,
3353,IMG_0216,PREM_15_478,PREM_15_478_216,J_Last-resort,1,"to me to any great force is Lord Carrington's it is a last thing. If this is right, it seems to me that it should be something which you do when you visibly have to, and not before: not as part of a deal for banning marches.",,,,
6832,IMG_5801,PREM_15_479,IMG_5801_PREM_15_479,J_Misc,1,"Despite the considerable success of the internment operation and the possibility that it will in time bring terrorism under control, the bombing has not abated and the mood of the country is very bad and getting worse.",,,,
8771,IMG_5801,PREM_15_479,IMG_5801_PREM_15_479,J_Terrorism,1,"I said that in my view the IRA, to which he was evidently referring, did not constitute a ""section"" of the community.",,,CODED WRONG?,
8772,IMG_5801,PREM_15_479,IMG_5801_PREM_15_479,J_Terrorism,2,"Despite the considerable success of the internment operation and the possibility that it will in time bring terrorism under control, the bombing has not abated and the mood of the country is very bad and getting worse.",,,,
1134,IMG_5802,PREM_15_479,IMG_5802_PREM_15_479,J_Development-Unity,1,One of Mr Faulkner's chief arguments for internment (and it was a strong argument) was that continued terrorism was threatening the economy of the country.,,,,
7700,IMG_5802,PREM_15_479,IMG_5802_PREM_15_479,J_Political-Strategic,1,"Another argument, which I still believe to have been a strong one, was that in July there were clear signs of a Protestant mood to take matters into their own hands and deal with the Catholics themselves. This mood is reviving.",,,,
8778,IMG_5802,PREM_15_479,IMG_5802_PREM_15_479,J_Terrorism,1,One of Mr Faulkner's chief arguments for internment (and it was a strong argument) was that continued terrorism was threatening the economy of the country.,,,,
8785,IMG_5835,PREM_15_479,IMG_5835_PREM_15_479,J_Terrorism,1,It is one of the few buildings that the IRA have not tried to blow up!,,,,
9296,IMG_5835,PREM_15_479,IMG_5835_PREM_15_479,J_Utilitarian-Deterrence,1,A released internee is of greater news value than an army widow or a soldier or policeman doing his job.,,,CODED WRONG?,
9297,IMG_5835,PREM_15_479,IMG_5835_PREM_15_479,J_Utilitarian-Deterrence,2,Tell Wilson that if there had been more interned sooner there would be less bombs and bloodshed today.,,,,
693,IMG_5589,PREM_15_480,IMG_5589_PREM_15_480,J_Denial,1,It is because of such involvement that persons are being held and not because of their political views or because they oppose the Government.,Y,No one is being held either because of his political views or because he opposes the Government,,
5173,IMG_5606,PREM_15_480,IMG_5606_PREM_15_480,J_Legal_Procedure,1,"1. Ministers here have agreed that the date now agreed for a tripartite summit means that it would hardly be possible to defer making internment orders until after the meeting. As far as we are concerned, therefore, the way is clear for the making of orders as soon as you have your appeal committee appointed.",,,,
5174,IMG_5606,PREM_15_480,IMG_5606_PREM_15_480,J_Legal_Procedure,2,Mr. [] suggests that the main stress of the statement should [] on the narrow scope of internment as defined in paragraph 2 and on the fact that the signing of the orders entitles internees to apply to the appeal committee. ,,,,
