,image_id,file_id,img_file_orig,justification,occurances,transcribed_text,handwriting,transcribed_handwriting,notes,,,11 in 20 min,33 in one hour,Total task: 5-6 hours (178 entries)
756,IMG_5722,PREM_15_481,IMG_5722_PREM_15_481,J_Denial,1,"Conditions at Long Kesh: We have been given the following information by the Northern Ireland Government in connection with today's Press Report appearing in the Morning Star about conditions at Long Kesh. 1. Accomodation: There are 40 men at present accommodated in huts originally planned for 34, but only parts of the camp have been completed and it is expected that with the completion of further building work in a fortnight's time this position will be relieved. 2. Cooking: Cooking is not done by electricity but by [] gas and the use of search lights therefore has no effect on the power available in the cook-hours; but there are electric hotplates in the mess halls and these developed a fault yesterday which was put right today. 3. Bunks: These are standard army issue. 4. Clothing: Internees were allowed to bring with them all the clothing they had in their possession. Those who wish to obtain a change of clothes can do so by having other garments brought in by relations or friends; alternatively if this is not possible clothing is issued to them. 5. Books: They were allowed to take in with them books they alread possessed and further supplies are being provided at Long Kesh as soon as possible. 75 newspapers are being provided free of charge daily.",,,,,,,,
763,IMG_5723,PREM_15_481,IMG_5723_PREM_15_481,J_Denial,1,"6. Television: A large television and a radio are provided in each hut. All are in good working order. 7. Heating: Huts are electrically heated and standards are considered adequate. 8. Searching: The searching of visitors is inevitable in present circumstances. P. Leychon; 21 September 1971. cc. Mr Woodfield, Mr Lindley, Mrs Birleson",,,,,,,,
8939,IMG_5766,PREM_15_481,IMG_5766_PREM_15_481,J_Terrorism,1,I said that it was deeply distressing but that the increasing activity and violence of the I.R.A. had left no alternative but the policy of internment.,,,,,,,,
6832,IMG_5801,PREM_15_479,IMG_5801_PREM_15_479,J_Misc,1,"Despite the considerable success of the internment operation and the possibility that it will in time bring terrorism under control, the bombing has not abated and the mood of the country is very bad and getting worse.",,,,,,,,
8771,IMG_5801,PREM_15_479,IMG_5801_PREM_15_479,J_Terrorism,1,"I said that in my view the IRA, to which he was evidently referring, did not constitute a ""section"" of the community.",,,CODED WRONG?,,,,,
8772,IMG_5801,PREM_15_479,IMG_5801_PREM_15_479,J_Terrorism,2,"Despite the considerable success of the internment operation and the possibility that it will in time bring terrorism under control, the bombing has not abated and the mood of the country is very bad and getting worse.",,,,,,,,
1134,IMG_5802,PREM_15_479,IMG_5802_PREM_15_479,J_Development-Unity,1,One of Mr Faulkner's chief arguments for internment (and it was a strong argument) was that continued terrorism was threatening the economy of the country.,,,,,,,,
7700,IMG_5802,PREM_15_479,IMG_5802_PREM_15_479,J_Political-Strategic,1,"Another argument, which I still believe to have been a strong one, was that in July there were clear signs of a Protestant mood to take matters into their own hands and deal with the Catholics themselves. This mood is reviving.",,,,,,,,
8778,IMG_5802,PREM_15_479,IMG_5802_PREM_15_479,J_Terrorism,1,One of Mr Faulkner's chief arguments for internment (and it was a strong argument) was that continued terrorism was threatening the economy of the country.,,,,,,,,
8785,IMG_5835,PREM_15_479,IMG_5835_PREM_15_479,J_Terrorism,1,It is one of the few buildings that the IRA have not tried to blow up!,,,,,,,,
9296,IMG_5835,PREM_15_479,IMG_5835_PREM_15_479,J_Utilitarian-Deterrence,1,A released internee is of greater news value than an army widow or a soldier or policeman doing his job.,,,CODED WRONG?,,,,,
9297,IMG_5835,PREM_15_479,IMG_5835_PREM_15_479,J_Utilitarian-Deterrence,2,Tell Wilson that if there had been more interned sooner there would be less bombs and bloodshed today.,,,,,,,,
4396,IMG_6110,PREM_15_483,IMG_6110_PREM_15_483,J_Legal_Procedure,1,"The government had this matter under consideration. They had received many reports from reliable people, including elected representatives and members of the legal proffession in the North. But, as yet, no decision had been taken on the matters referred to",,,,,,,,
5810,IMG_6110,PREM_15_483,IMG_6110_PREM_15_483,J_Misc,1,"It had been alleged that in the Republic we were tolerant of illegal organisations: that our controls were lax in regard to the storage and movement of explosives, and that consequently there was a good deal of illegal cross-border activity.",,,,,,,,
5215,IMG_6133,PREM_15_482,IMG_6133_PREM_15_482,J_Legal_Procedure,1,4. On internment Hume pursued the theme of the Special Court to sit without jury under a judge who commanded the respect of the minority.,,,,,,,,
5285,IMG_6239,PREM_15_482,IMG_6239_PREM_15_482,J_Legal_Procedure,1,"3. If the advisory committee examining the internees produces results which could have a good chance of getting the SDLP into the talks, it is all the more important to be able to say something in Dublin, even if only in private, about the point in paragraph 2.",,,,,,,,
4438,IMG_6315,PREM_15_484,IMG_6315_PREM_15_484,J_Legal_Procedure,1,(2) A detained person will be given full opportunities to make representations in writing to the Secretary of State regarding his case or his treatment.,,,,,,,,
3213,IMG_6421,PREM_15_486,IMG_6421_PREM_15_486,J_Intl-Domestic_Precedent,1,"There is however some mention in the British press today, related to the raid on the Sein Fein buildings, of action being taken by the Eire government to proceed with internment on their own.",y,"There is however some mention in the British press today, related to the raid on the Sein Fein buildings, of possible action being taken by the Republic to proceed with internment on their own.",,,,,,
1246,IMG_6461,PREM_15_1000,IMG_6461_PREM_15_1000,J_Emergency-Policy,1,"It is just possible, therefore, that, if the Government said publicly that internment would not be ended so long as violence persisted but that, if violence ceased, they would be prepared to consider ending internment and to legislate on the above lines, moderate opinion might be sufficiently rallied to compel Mr. Faulkner's more extreme supporters to accept this degree of amendment of the Stormont system.",,,,,,,,
7049,IMG_6461,PREM_15_1000,IMG_6461_PREM_15_1000,J_Political-Strategic,1,"It is just possible, therefore, that, if the Government said publicly that internment would not be ended so long as violence persisted but that, if violence ceased, they would be prepared to consider ending internment and to legislate on the above lines, moderate opinion might be sufficiently rallied to compel Mr. Faulkner's more extreme supporters to accept this degree of amendment of the Stormont system. It would, of course, be highly resented and actively opposed by the Protestant Right Wing; but, if it was the price of preserving the separate Parliament and some continuing degree of autonomy, local opinion might decide that it was a price worth paying.",,,,,,,,
3962,IMG_6468,PREM_15_1000,IMG_6468_PREM_15_1000,J_Legal_Procedure,1,"Prosecution of internees. 13. A check is being made on the statement by the spokesman of the Alliance party during the BBC debate programme, that there were some internees who could be prosecuted on the basis of evidence from solider witnesses alone - in which case intimidation would not be a problem (though identification might be).",,,,,,,,
1260,IMG_6477,PREM_15_1000,IMG_6477_PREM_15_1000,J_Emergency-Policy,1,"Internment. The meeting discussed, first, improvements in procedure, which the Northern Ireland Government are considering; second, the need to cater for the increasing number of internees (reinforcements from the English prison service are gradually moving over to Northern Ireland); and, third, the case for identifying the internees who could safely be let out when a definite improvement in the security situation permits it.",,,,,,,,
5418,IMG_6477,PREM_15_1000,IMG_6477_PREM_15_1000,J_Misc,1,on attacks on the houses of prominent individuals. ,,,,,,,,
7056,IMG_6479,PREM_15_1000,IMG_6479_PREM_15_1000,J_Political-Strategic,1,"8. Technically the complete ban on marches which was imposed concurrently with the introduction of internment was only for six months - and is therefore due to lapse at the end of January, if not renewed. For both political and military reasons it seems essential that the ban should in fact be continued and the GOC is accordingly pressing for it to be renewed.",,,,,,,,
3969,IMG_6489,PREM_15_1000,IMG_6489_PREM_15_1000,J_Legal_Procedure,1,Still held: under Regulation 10: 36,,,,,,,,
5432,IMG_6493,PREM_15_1000,IMG_6493_PREM_15_1000,J_Misc,1,"While he is here he will be asked for his assessment of whether, as some time has now elapsed since anyone was interrogated in depth, there is now less apprehension in the minds of detainees about the possibility of being put through the process - and, if so, whether there is correspondingly less willingness to give information under ordinary interrogation.",,,,,,,,
3976,IMG_6497,PREM_15_1000,IMG_6497_PREM_15_1000,J_Legal_Procedure,1,Some weeks ago another detainee who had similarly been unlawfully arrested was granted a writ of habeas corpus; the RUC rearrested him properly under the Special Powers Act immediately he was released).,,,,,,,,
3977,IMG_6497,PREM_15_1000,IMG_6497_PREM_15_1000,J_Legal_Procedure,2,This development will presumably not encourage the Northern Ireland authorities to prefer charges against men arrested under the Special Powers Act.,,,,,,,,
1267,IMG_6520,PREM_15_1000,IMG_6520_PREM_15_1000,J_Emergency-Policy,1,"Assume the military success is scored, what then? The advice that comes from Stormont is that in those circumstances, with intimidation lifted and lawful authority restored, the near-insurrection of large sections of the Roman Catholic community would come to an end. Constitutional politics could begin again, consent would be forthcoming, the corpus of legislative reform undertaken in the last two years would work through into the social system to everyone's benefit, consultations for institutional change could be begun on the lines indicated in Mr. Faulkner's Green Paper of October, and--in a word--normal service could be resumed.",,,,,,,,
3983,IMG_6538,PREM_15_1000,IMG_6538_PREM_15_1000,J_Legal_Procedure,1,"Mr. Faulkner has already undertaken to put forward composite proposals about the running of internment, which ought certainly to include those aspects of the matter - as well as the case for strengthening Judge Brown's committee so that it could work through more than one panel at a time.",,,,,,,,
5446,IMG_6538,PREM_15_1000,IMG_6538_PREM_15_1000,J_Misc,1,"But, as the GOC emphasised to the Home Secretary yesterday, it would be greatly preferable to avoid any releases based simply on expediency and concentrate instead on creating proper arrangements for categorising the internees, attempting to rehabilitate the more amenable among them and releasing those who really seem ready for it. ",,,,,,,,
5481,IMG_6635,PREM_15_1001,IMG_6635_PREM_15_1001,J_Misc,1,"For instance, it may not be realised that, since the introduction of internment, some 200 people arrested for arms and explosives offences have been tried and convicted. In other words, it was possible to avoid interning them.",,,,,,,,
4046,IMG_6711,PREM_15_1001,IMG_6711_PREM_15_1001,J_Legal_Procedure,1,The Prime Minister said that the Advisory Committee were continuing to recommend the release of those whom they thought it right to release; about 30 had already been released. He did not think that the IRA were not so short of arms that large numbers of internees could safely be released.,,,,,,,,
7854,IMG_6711,PREM_15_1001,IMG_6711_PREM_15_1001,J_Terrorism,1,The Prime Minister said that the Advisory Committee were continuing to recommend the release of those whom they thought it right to release; about 30 had already been released. He did not think that the IRA were not so short of arms that large numbers of internees could safely be released.,,,,,,,,
4060,IMG_6721,PREM_15_1001,IMG_6721_PREM_15_1001,J_Legal_Procedure,1,"The latest complete figures for those arrested in Northern Ireland under the Special Powers Acts are as follows. They are correct up to 12 January. Arrested: 2,009. Released without detention order: 1,153. Released after detention order: 97. Released after consideration by Advisory Committee: 26. Released from internment on recommendation of RUC: 2. 1,278. 731. Held under Regulation 10: 25. Held under detention order: 203. Interned: 503. 731. The latest figures for the Judge Brown Advisory Committee as at 12 January are:- Cases reviewed: 371. Number who refused to appear before the Committee: 289. Not recommended for release: 337. Recommended for release: 30. Released: 26. Refused to take oath and consequently still interned: 2. Recommendations still with the Ministry of Home Affairs: 2. Cases adjourned: 5.",,,,,,,,
5530,IMG_6778,PREM_15_1002,IMG_6778_PREM_15_1002,J_Misc,1,"It has to be remembered that the substantial progress which has been made in Belfast, in mopping up known IRA members, has not so far been matched in other parts of the Province. In Belfast the build-up of intelligence, as a result of internment, has enabled this process to be pursued with such vigour, that the number of effective terrorists remaining at large within the city can be gauged.",,,,,,,,
7882,IMG_6778,PREM_15_1002,IMG_6778_PREM_15_1002,J_Terrorism,1,"The Northern Ireland Government has made a provisional classification of all the internees into three categories. Those in the category of least danger - which contains roughly 25 percent (or 150) of the present internees - are mostly those who actually throw the bombs and fire the rifles. They are all IRA men; and their release carries the risk that they would go straight back to their previous activities, with an incentive to assassinate those in the security forces whom they now think they know to have been responsible for their original detention.",,,,,,,,
7883,IMG_6778,PREM_15_1002,IMG_6778_PREM_15_1002,J_Terrorism,2,"It has to be remembered that the substantial progress which has been made in Belfast, in mopping up known IRA members, has not so far been matched in other parts of the Province. In Belfast the build-up of intelligence, as a result of internment, has enabled this process to be pursued with such vigour, that the number of effective terrorists remaining at large within the city can be gauged.",,,,,,,,
9065,IMG_6778,PREM_15_1002,IMG_6778_PREM_15_1002,J_Utilitarian-Deterrence,1,"The Northern Ireland Government has made a provisional classification of all the internees into three categories. Those in the category of least danger - which contains roughly 25 percent (or 150) of the present internees - are mostly those who actually throw the bombs and fire the rifles. They are all IRA men; and their release carries the risk that they would go straight back to their previous activities, with an incentive to assassinate those in the security forces whom they now think they know to have been responsible for their original detention.",,,,,,,,
4109,IMG_6784,PREM_15_1002,IMG_6784_PREM_15_1002,J_Legal_Procedure,1,"The latest complete figures for those arrested in Northern Ireland under the Special Powers Acts are as follows. They are correct up to 14th February. Arrested: 2,447. Released without detention order: 1,474. Released after detention order: 115. Escaped from detention: 10. Released after consideration by Advisory Committee: 31. Others released from internment: 4. Escaped from internment: 1. 1,635. 812. Held under Regulation 10: 37. Held under detention order: 124. Interned: 651. 812.",,,,,,,,
4137,IMG_6840,PREM_15_1002,IMG_6840_PREM_15_1002,J_Legal_Procedure,1,"The latest complete figures for those arrested in Northern Ireland under the Special Powers Acts are as follows. They are correct up to 7 February. Arrested: 2,364. Released without detention order: 1,408. Released after detention order: 113. Escaped from detentions: 10. Released after consideration by Advisory Committee: 31. Released from internment on recommendation of RUC: 2. 1,564. 800. Held under Regulation 10: 42. Held under detention order: 160. Interned: 598. 800. Statistics of proceedings before the Advisory Committee as at 31 January are as follows: Cases reviewed: 383. internees refused to appear: 291. Continued internment recommended: 345. Release recommended: 35. Refused to give undertaking not to indulge in violence or encourage others to do so and therefore still interned: 4. Cases adjourned: 3.",,,,,,,,
3409,IMG_6843,PREM_15_1002,IMG_6843_PREM_15_1002,J_Law-and-order,1,"(i) Whether the internee was interned on reasonable grounds? (In assessing this they have in mind the regulations under the Special Powers Act which permit internment ""for securing the preservation of peace and the maintenance of order"").",,,,,,,,
4151,IMG_6843,PREM_15_1002,IMG_6843_PREM_15_1002,J_Legal_Procedure,1,"On the last occasion when internment was in operation, a directive was given to the Committee. No directive has been issued on this occasion as it was thought better to emphasise the complete independence of the Committee from the Northern Ireland Government.",,,,,,,,
4152,IMG_6843,PREM_15_1002,IMG_6843_PREM_15_1002,J_Legal_Procedure,2,"(i) Whether the internee was interned on reasonable grounds? (In assessing this they have in mind the regulations under the Special Powers Act which permit internment ""for securing the preservation of peace and the maintenance of order"").",,,,,,,,
9086,IMG_6843,PREM_15_1002,IMG_6843_PREM_15_1002,J_Utilitarian-Deterrence,1,(ii) What are the present attitudes and probable future intentions of the internee.,,,,,,,,
4158,IMG_6913,PREM_15_1003,IMG_6913_PREM_15_1003,J_Legal_Procedure,1,"The latest complete figures for those arrested in Northern Ireland under the Special Powers Acts are as follows. They are correct up to 2 March. Arrested: 2,644. Released without detention order: 1,568. Released after detention order: 148. Escaped from detention: 10. Released after consideration by Advisory Committee: 44. Others released from internment: 4. Escaped from internment: 1. 1,775. 869. Held under Regulation 10: 55. Held under detention order: 129. Interned: 685. 869.",,,,,,,,
5572,IMG_6925,PREM_15_1003,IMG_6925_PREM_15_1003,J_Misc,1,"And accompanying that activity - the bombing, the shooting, the intimidation - has been an utterly unscrupulous propaganda campaign. This has been designed to spread the notion that if we had not interned, everything would now be quite peaceful: Or that if we were to bring internment to an end, that would rapidly guarantee a return to peaceful conditions; and that in the meantime internment has been the great 'recruiting sergeant for the IRA'. ""The time has surely come to demonstrate what [cant] all of this is. Was the situation before internment getting better?",,,,,,,,
4627,IMG_8505,PREM_15_1016,IMG_8505_PREM_15_1016,J_Legal_Procedure,1,The Government expressed regret that such an order should be necessary in any part of the United Kingdom. The Order gives effect to the Government's decision to end internment and detention by the Executive and provides for the establishment of Commissions.,,,,,,,,
4628,IMG_8505,PREM_15_1016,IMG_8505_PREM_15_1016,J_Legal_Procedure,2,"12. The Secretary of State received on 6 December the report of the Diplock Commission, which has been considering changes in the administration of justice in Northern Ireland in order to deal more effectively with terrorists.",,,,,,,,
6090,IMG_8505,PREM_15_1016,IMG_8505_PREM_15_1016,J_Misc,1,The Government expressed regret that such an order should be necessary in any part of the United Kingdom. The Order gives effect to the Government's decision to end internment and detention by the Executive and provides for the establishment of Commissions.,,,,,,,,
8225,IMG_8505,PREM_15_1016,IMG_8505_PREM_15_1016,J_Terrorism,1,"10. The House of Commons approved the Detention of Terrorists (Northern Ireland) Order by 179 to 32 votes. Most Labour members, including Shadow Ministers abstained.",,,,,,,,
8226,IMG_8505,PREM_15_1016,IMG_8505_PREM_15_1016,J_Terrorism,2,"12. The Secretary of State received on 6 December the report of the Diplock Commission, which has been considering changes in the administration of justice in Northern Ireland in order to deal more effectively with terrorists.",,,,,,,,
4655,IMG_8716,PREM_15_1690,IMG_8716_PREM_15_1690,J_Legal_Procedure,1,7. There have been 18 appeals to the Tribunal 9 of which have been heard. The Tribunal confirmed the detention of 6 and discharged 3.,,,,,,,,
4656,IMG_8716,PREM_15_1690,IMG_8716_PREM_15_1690,J_Legal_Procedure,2,Those held in detention under Special Powers legislation now total 343 and are made up of: a. Detained by Commissioners: 286; b. Held on Interim Custody Orders: 57.,,,,,,,,
6146,IMG_9322,PREM_15_1692,IMG_9322_PREM_15_1692,J_Misc,1,"The Government would greatly prefer it if the ordinary criminal procedures were effective in bringing these people to justice, but the findings of the Diplock Commission prove conclusively that they are not and cannot be so effective.",y,"The Government would greatly prefer it if the ordinary criminal procedures were effective in bringing these people to justice, but the findings of the Diplock Commission were that they are not and cannot be so effective under present conditions in Northern Ireland.",,,,,,
3920,IMG_9572,DEFE_13_1358,IMG_9572_DEFE_13_1358,J_Legal_Procedure,1,"In case this should happen, it was all the more important that the Tribunals should be seen to be operating fairly and effectively.",,,,,,,,
5362,IMG_9572,DEFE_13_1358,IMG_9572_DEFE_13_1358,J_Misc,1,"The possibility had to be faced that the Commission might report that there was no effective alternative to internment. In case this should happen, it was all the more important that the Tribunals should be seen to be operating fairly and effectively.",,,,,,,,
5376,IMG_9630,DEFE_13_1358,IMG_9630_DEFE_13_1358,J_Misc,1,"The key to successful military operations remains the acquisition of corroborated intelligence, the supply of which, though much improved, continues to be restricted by overriding political and legal restraints.",,,,,,,,
5390,IMG_9742,DEFE_13_1358,IMG_9742_DEFE_13_1358,J_Misc,1,The arrest and internment of wanted men continued and several important IRA officers were captured.,,,,,,,,
5761,IMG_0032,PREM_15_1010,PREM_15_1010_032,J_Misc,1,"On the answer to this question depends whether those who are taken in for interrogation, or some of them at any rate, are kept in custody - detention and internment. Without the prospect that at least some of those interrogated would be interned, the process of interrogation would be unlikely to succeed.",,,,,,,,
8533,IMG_0143,PREM_15_478,PREM_15_478_143,J_Terrorism,1,Internment had been introduced because the Government was faced with terrorism on an intolerable scale. It was the common interest of both countries to combat the activities of gunmen and it was hoped that the Governmnet of the Republic would be able to help achieve that objective.,,,,,,,,
6601,IMG_0160,PREM_15_478,PREM_15_478_160,J_Misc,1,"As you will see the best news is the good ""catch"" (304 [] 464).",,,,,,,,
1022,IMG_0186,PREM_15_478,PREM_15_478_186,J_Development-Unity,1,serious acts of terrorism by the I.R.A. and their recent declarations of their intention to continue and even escalate their campaign have made it impossible for him to resist the pressures on him for more drastic action to arrest the deterioration of morale and the undermining of economic and social stability in Northern Ireland.,y,"serious acts of terrorism by the I.R.A. and their recent declarations of their intention to continue and even escalate their campaign have made it essential to take this action, however abhorrent, [] in order to prevent the undermining of economic and social stability in Northern Ireland.",,,,,,
3297,IMG_0186,PREM_15_478,PREM_15_478_186,J_Last-resort,1,"In purely military terms, seeking to contain the situation by the means employed hitherto would have meant at best a long haul; and Faulkner's judgment was that the consequences of that for thecommunity would be worse than the consequences of what is now proposed.",y,"In purely military terms, seeking to contain this deteriorating situation by the means employed hitherto would have meant at best a long haul; and Faulkner's judgment was that the consequences of that for thecommunity would be worse than the consequences of what is now proposed.",,,,,,
8659,IMG_0186,PREM_15_478,PREM_15_478_186,J_Terrorism,1,serious acts of terrorism by the I.R.A. and their recent declarations of their intention to continue and even escalate their campaign have made it impossible for him to resist the pressures on him for more drastic action to arrest the deterioration of morale and the undermining of economic and social stability in Northern Ireland.,y,"serious acts of terrorism by the I.R.A. and their recent declarations of their intention to continue and even escalate their campaign have made it essential to take this action, however abhorrent, [] in order to prevent the undermining of economic and social stability in Northern Ireland.",,,,,,
